{
  "$schema": "./reference-scan-outcomes.schema.json",
  "schemaVersion": 1,
  "generatedAt": "2026-07-16T12:52:16.996Z",
  "sourceCorpusVersion": "1.2.0",
  "publicationClass": "diagnostic-only",
  "outcomeCount": 20,
  "rightsPolicy": "sanitized-scan-metadata-only-no-raw-artifacts",
  "summary": {
    "relevantNewestAttempts": 20,
    "statusCounts": {
      "complete": 11,
      "partial": 7,
      "failed": 0,
      "unsupported": 2
    },
    "eligibilityCounts": {
      "eligibleCompleteObservation": 7,
      "diagnosticOnly": 13
    },
    "viewportStatusCounts": {
      "complete": 24,
      "partial": 11,
      "unsupported": 5,
      "missing": 0
    }
  },
  "outcomes": [
    {
      "refId": "ref-001",
      "capturedAt": "2026-07-16T11:43:45.801Z",
      "status": "partial",
      "eligibility": "diagnostic-only",
      "issues": [
        "capture-contract-partial",
        "entrance-timing-missed"
      ],
      "limitations": [
        "direct-timeline-introspection-unavailable",
        "human-visual-review-required",
        "incomplete-viewport-coverage",
        "network-policy-subresources-blocked",
        "not-normal-observation-evidence"
      ],
      "viewportCoverage": [
        {
          "viewport": "desktop",
          "viewportStatus": "partial",
          "entranceSamples": {
            "requested": 7,
            "recorded": 7,
            "artifactsCaptured": 7,
            "met": 6,
            "missed": 1,
            "failed": 0
          },
          "scrollSamples": {
            "requested": 10,
            "recorded": 10,
            "artifactsCaptured": 10,
            "met": 10,
            "missed": 0,
            "unsupported": 0,
            "notApplicable": 0
          },
          "interactionSamples": {
            "requested": 0,
            "recorded": 0,
            "artifactsCaptured": 0,
            "met": 0,
            "failed": 0,
            "policyBlocked": 0,
            "notApplicable": 0
          },
          "settledSamples": {
            "requested": 1,
            "recorded": 1,
            "artifactsCaptured": 1,
            "met": 1
          },
          "reducedMotionArtifacts": {
            "requested": 2,
            "captured": 2
          },
          "videoArtifacts": {
            "requested": 1,
            "captured": 1
          },
          "traceArtifacts": {
            "requested": 0,
            "captured": 0
          },
          "runtimeCounts": {
            "consoleMessages": 200,
            "runtimeErrors": 0,
            "requestFailures": 30,
            "reducedMotionFailures": 0
          }
        },
        {
          "viewport": "mobile",
          "viewportStatus": "complete",
          "entranceSamples": {
            "requested": 7,
            "recorded": 7,
            "artifactsCaptured": 7,
            "met": 7,
            "missed": 0,
            "failed": 0
          },
          "scrollSamples": {
            "requested": 10,
            "recorded": 10,
            "artifactsCaptured": 10,
            "met": 10,
            "missed": 0,
            "unsupported": 0,
            "notApplicable": 0
          },
          "interactionSamples": {
            "requested": 0,
            "recorded": 0,
            "artifactsCaptured": 0,
            "met": 0,
            "failed": 0,
            "policyBlocked": 0,
            "notApplicable": 0
          },
          "settledSamples": {
            "requested": 1,
            "recorded": 1,
            "artifactsCaptured": 1,
            "met": 1
          },
          "reducedMotionArtifacts": {
            "requested": 2,
            "captured": 2
          },
          "videoArtifacts": {
            "requested": 1,
            "captured": 1
          },
          "traceArtifacts": {
            "requested": 0,
            "captured": 0
          },
          "runtimeCounts": {
            "consoleMessages": 157,
            "runtimeErrors": 0,
            "requestFailures": 24,
            "reducedMotionFailures": 0
          }
        }
      ],
      "rights": {
        "publicSurface": "sanitized-diagnostic-scan-metadata-only",
        "rawArtifactsPublished": false,
        "copiedCode": false,
        "copiedAssets": false,
        "usableForMotionVerification": false
      }
    },
    {
      "refId": "ref-002",
      "capturedAt": "2026-07-16T11:46:14.846Z",
      "status": "complete",
      "eligibility": "eligible-complete-observation",
      "issues": [],
      "limitations": [
        "direct-timeline-introspection-unavailable",
        "human-visual-review-required",
        "network-policy-subresources-blocked"
      ],
      "viewportCoverage": [
        {
          "viewport": "desktop",
          "viewportStatus": "complete",
          "entranceSamples": {
            "requested": 7,
            "recorded": 7,
            "artifactsCaptured": 7,
            "met": 7,
            "missed": 0,
            "failed": 0
          },
          "scrollSamples": {
            "requested": 10,
            "recorded": 10,
            "artifactsCaptured": 10,
            "met": 10,
            "missed": 0,
            "unsupported": 0,
            "notApplicable": 0
          },
          "interactionSamples": {
            "requested": 0,
            "recorded": 0,
            "artifactsCaptured": 0,
            "met": 0,
            "failed": 0,
            "policyBlocked": 0,
            "notApplicable": 0
          },
          "settledSamples": {
            "requested": 1,
            "recorded": 1,
            "artifactsCaptured": 1,
            "met": 1
          },
          "reducedMotionArtifacts": {
            "requested": 2,
            "captured": 2
          },
          "videoArtifacts": {
            "requested": 1,
            "captured": 1
          },
          "traceArtifacts": {
            "requested": 0,
            "captured": 0
          },
          "runtimeCounts": {
            "consoleMessages": 53,
            "runtimeErrors": 0,
            "requestFailures": 55,
            "reducedMotionFailures": 0
          }
        },
        {
          "viewport": "mobile",
          "viewportStatus": "complete",
          "entranceSamples": {
            "requested": 7,
            "recorded": 7,
            "artifactsCaptured": 7,
            "met": 7,
            "missed": 0,
            "failed": 0
          },
          "scrollSamples": {
            "requested": 10,
            "recorded": 10,
            "artifactsCaptured": 10,
            "met": 10,
            "missed": 0,
            "unsupported": 0,
            "notApplicable": 0
          },
          "interactionSamples": {
            "requested": 0,
            "recorded": 0,
            "artifactsCaptured": 0,
            "met": 0,
            "failed": 0,
            "policyBlocked": 0,
            "notApplicable": 0
          },
          "settledSamples": {
            "requested": 1,
            "recorded": 1,
            "artifactsCaptured": 1,
            "met": 1
          },
          "reducedMotionArtifacts": {
            "requested": 2,
            "captured": 2
          },
          "videoArtifacts": {
            "requested": 1,
            "captured": 1
          },
          "traceArtifacts": {
            "requested": 0,
            "captured": 0
          },
          "runtimeCounts": {
            "consoleMessages": 51,
            "runtimeErrors": 0,
            "requestFailures": 54,
            "reducedMotionFailures": 0
          }
        }
      ],
      "rights": {
        "publicSurface": "sanitized-diagnostic-scan-metadata-only",
        "rawArtifactsPublished": false,
        "copiedCode": false,
        "copiedAssets": false,
        "usableForMotionVerification": false
      }
    },
    {
      "refId": "ref-004",
      "capturedAt": "2026-07-16T11:49:09.861Z",
      "status": "complete",
      "eligibility": "eligible-complete-observation",
      "issues": [],
      "limitations": [
        "direct-timeline-introspection-unavailable",
        "human-visual-review-required",
        "network-policy-subresources-blocked"
      ],
      "viewportCoverage": [
        {
          "viewport": "desktop",
          "viewportStatus": "complete",
          "entranceSamples": {
            "requested": 7,
            "recorded": 7,
            "artifactsCaptured": 7,
            "met": 7,
            "missed": 0,
            "failed": 0
          },
          "scrollSamples": {
            "requested": 10,
            "recorded": 10,
            "artifactsCaptured": 10,
            "met": 10,
            "missed": 0,
            "unsupported": 0,
            "notApplicable": 0
          },
          "interactionSamples": {
            "requested": 0,
            "recorded": 0,
            "artifactsCaptured": 0,
            "met": 0,
            "failed": 0,
            "policyBlocked": 0,
            "notApplicable": 0
          },
          "settledSamples": {
            "requested": 1,
            "recorded": 1,
            "artifactsCaptured": 1,
            "met": 1
          },
          "reducedMotionArtifacts": {
            "requested": 2,
            "captured": 2
          },
          "videoArtifacts": {
            "requested": 1,
            "captured": 1
          },
          "traceArtifacts": {
            "requested": 0,
            "captured": 0
          },
          "runtimeCounts": {
            "consoleMessages": 48,
            "runtimeErrors": 0,
            "requestFailures": 33,
            "reducedMotionFailures": 0
          }
        },
        {
          "viewport": "mobile",
          "viewportStatus": "complete",
          "entranceSamples": {
            "requested": 7,
            "recorded": 7,
            "artifactsCaptured": 7,
            "met": 7,
            "missed": 0,
            "failed": 0
          },
          "scrollSamples": {
            "requested": 10,